URL,Version,Status,OIDs,Name,Title,Description,Uses,Used,Sources
http://dicom.nema.org/medical/dicom/current/output/chtml/part16/sect_CID_33.html,2025.3.20250714,active,"1.2.840.10008.6.1.1283",Modality,,"Transitive closure of CID 33 Modality","StructureDefinition/guideline-attachment","DICOM"
http://fhir.awmf.org/awmf.ig/ValueSet/ocebm-2011-levels-of-evidence-vs,0.2.0,draft,,OCEBM2011LevelsOfEvidenceVS,OCEBM 2011 Levels of Evidence Value Set,"ValueSet encompassing all levels from the OCEBM 2011 Levels of Evidence.","StructureDefinition/recommendation-justification-oxford-2011","Internal"
http://fhir.awmf.org/awmf.ig/ValueSet/vs-agree-ii-domains,0.2.0,active,,AGREEIIDomainsVS,AGREE II Domains Value Set,"ValueSet encompassing all domains from the AGREE II instrument.",,"Internal"
http://fhir.awmf.org/awmf.ig/ValueSet/vs-amstar2-confidence-ratings,0.2.0,active,,AMSTAR2ConfidenceRatingsVS,AMSTAR 2 Confidence Ratings Value Set,"ValueSet encompassing all overall confidence ratings from the AMSTAR 2 critical appraisal tool.",,"Internal"
http://fhir.awmf.org/awmf.ig/ValueSet/vs-awmf-guideline-class,0.2.0,draft,,AWMFGuidelineClassVS,AWMF Guideline Class,"ValueSet listing values representing guideline classes according to the AWMF.","StructureDefinition/awmf-guideline-record-s2k,StructureDefinition/awmf-guideline-record-s3,StructureDefinition/guideline-registry-record,StructureDefinition/awmf-guideline-record-s2e,StructureDefinition/awmf-guideline-record-s1","Internal"
http://fhir.awmf.org/awmf.ig/ValueSet/vs-awmf-guideline-status,0.2.0,draft,,AWMFGuidelineStatusVS,AWMF Guideline Status,"ValueSet listing values to define the guideline status according to the AWMF.",,"Internal"
http://fhir.awmf.org/awmf.ig/ValueSet/vs-body-system-conditions,0.2.0,draft,,BodySystemConditionsVS,Body System Conditions,"ValueSet listing various body system conditions",,"Internal"
http://fhir.awmf.org/awmf.ig/ValueSet/vs-care-level,0.2.0,draft,,CareLevelVS,Care Level,"ValueSet listing levels of care.","StructureDefinition/awmf-guideline-record-s2k,StructureDefinition/awmf-guideline-record-s3,StructureDefinition/guideline-registry-record,StructureDefinition/awmf-guideline-record-s2e,StructureDefinition/awmf-guideline-record-s1","Internal"
http://fhir.awmf.org/awmf.ig/ValueSet/vs-care-stage,0.2.0,draft,,CareStageVS,Care Stage,"ValueSet listing stages of care from prevention to rehabilitation.","StructureDefinition/awmf-guideline-record-s2k,StructureDefinition/awmf-guideline-record-s3,StructureDefinition/guideline-registry-record,StructureDefinition/awmf-guideline-record-s2e,StructureDefinition/awmf-guideline-record-s1","Internal"
http://fhir.awmf.org/awmf.ig/ValueSet/vs-clinical-application-type,0.2.0,draft,,ClinicalApplicationTypeVS,Clinical Application Type,"ValueSet listing different clinical application types","StructureDefinition/recommendation","Internal"
http://fhir.awmf.org/awmf.ig/ValueSet/vs-content-types,0.2.0,draft,,ContentTypesVS,Content Types,"ValueSet listing types of content that can be part of a guideline or recommendation.","StructureDefinition/awmf-guideline-record-s2k,StructureDefinition/guideline-attachment,StructureDefinition/recommendation,StructureDefinition/awmf-guideline-record-s3,StructureDefinition/guideline-registry-record,StructureDefinition/awmf-guideline-record-s2e,StructureDefinition/awmf-guideline-record-s1","Internal"
http://fhir.awmf.org/awmf.ig/ValueSet/vs-dissemination-website,0.2.0,draft,,DisseminationWebsite,Dissemination Website,"ValueSet listing types of dissemination websites","StructureDefinition/awmf-guideline-record-s2k,StructureDefinition/awmf-guideline-record-s3,StructureDefinition/guideline-registry-record,StructureDefinition/awmf-guideline-record-s2e,StructureDefinition/awmf-guideline-record-s1","Internal"
http://fhir.awmf.org/awmf.ig/ValueSet/vs-encounter-type,0.2.0,draft,,EncounterTypeVS,Encounter Type,"ValueSet listing types of patient encounters based on hospitalization status.","StructureDefinition/awmf-guideline-record-s2k,StructureDefinition/awmf-guideline-record-s3,StructureDefinition/guideline-registry-record,StructureDefinition/awmf-guideline-record-s2e,StructureDefinition/awmf-guideline-record-s1","Internal"
http://fhir.awmf.org/awmf.ig/ValueSet/vs-guideline-author-role,0.2.0,draft,,GuidelineAuthorRoleVS,Guideline Author Role,"ValueSet listing roles that a author can have in a guideline.","StructureDefinition/ext-guideline-author-role","Internal"
http://fhir.awmf.org/awmf.ig/ValueSet/vs-guideline-contact-point,0.2.0,draft,,GuidelineContactPointVS,Guideline Contact Point VS,"ValueSet listing contact points relevant to guidelines, such as registrants, coordinators, and main contacts.",,"Internal"
http://fhir.awmf.org/awmf.ig/ValueSet/vs-guideline-release-type,0.2.0,draft,,GuidelinesReleaseTypeVS,Guideline Release Type,"ValueSet listing different guideline release types","StructureDefinition/awmf-guideline-record-s2k,StructureDefinition/awmf-guideline-record-s3,StructureDefinition/guideline-registry-record,StructureDefinition/awmf-guideline-record-s2e,StructureDefinition/awmf-guideline-record-s1","Internal"
http://fhir.awmf.org/awmf.ig/ValueSet/vs-guideline-sections,0.2.0,draft,,GuidelineSectionsVS,Guideline Sections,"ValueSet listing values to use to define guideline sections","StructureDefinition/awmf-guideline,StructureDefinition/recommendation","hl7.fhir.uv.ebm,Internal"
http://fhir.awmf.org/awmf.ig/ValueSet/vs-intended-audience,0.2.0,draft,,IntendedAudienceVS,Intended Audience Value Set,"ValueSet listing codes representing intended audiences for a section","StructureDefinition/ext-section-intended-audience","Internal"
http://fhir.awmf.org/awmf.ig/ValueSet/vs-level-of-consensus,0.2.0,draft,,LevelOfConsensusVS,Level Of Consensus,"ValueSet listing values to define the level of consensus for a recommendation.","StructureDefinition/recommendation-justification-grade,StructureDefinition/recommendation-justification-sign,StructureDefinition/recommendation-justification-expert-consensus,StructureDefinition/recommendation-justification-oxford-2011,StructureDefinition/recommendation-justification,StructureDefinition/recommendation-justification-oxford-2009,StructureDefinition/recommendation-justification-awmf","Internal"
http://fhir.awmf.org/awmf.ig/ValueSet/vs-medical-subject-categories,0.2.0,draft,,MedicalSubjectCategoriesVS,Medical Subject Categories,"ValueSet listing values to classify medical subjects into different categories.","StructureDefinition/ext-medical-subject-category","Internal"
http://fhir.awmf.org/awmf.ig/ValueSet/vs-ocebm-2009-levels-of-evidence,0.2.0,draft,,OCEBM2009LevelsOfEvidenceVS,OCEBM 2009 Levels of Evidence Value Set,"ValueSet encompassing all levels from the Oxford Centre for Evidence-Based Medicine 2009 Levels of Evidence.","StructureDefinition/recommendation-justification-oxford-2009","Internal"
http://fhir.awmf.org/awmf.ig/ValueSet/vs-pico,0.2.0,draft,,PICOVS,PICO related terms,"ValueSet listing different terms related to PICO question and objects",,"Internal"
http://fhir.awmf.org/awmf.ig/ValueSet/vs-rating-acceptability,0.2.0,draft,,RatingAcceptability,Rating Acceptability,"ValueSet defining if the alternatives are acceptable for the target population and its implementors?","StructureDefinition/recommendation-justification-grade","Internal"
http://fhir.awmf.org/awmf.ig/ValueSet/vs-rating-benefits-and-harms,0.2.0,draft,,RatingBenefitAndHarms,Rating Benefits And Harms,"ValueSet listing values to represent the summary of the most important benefits and harms","StructureDefinition/recommendation-justification-grade","Internal"
http://fhir.awmf.org/awmf.ig/ValueSet/vs-rating-certainty-of-evidence,0.2.0,draft,,RatingCertaintyofEvidence,Rating Certainty Of Evidence,"Codes from EvidenceCertaintyRating related to certainty of evidence","StructureDefinition/recommendation-justification-grade,StructureDefinition/evidence-overall-assessment-grade","THO"
http://fhir.awmf.org/awmf.ig/ValueSet/vs-rating-concern-degree,0.2.0,draft,,RatingConcernDegree,Rating Concern Degree,"ValueSet listing codes from EvidenceCertaintyRating related to degree of concern",,"THO"
http://fhir.awmf.org/awmf.ig/ValueSet/vs-rating-equity,0.2.0,draft,,RatingEquity,Rating Equity,"ValueSet listing values to represent how the different alternatives affect equity","StructureDefinition/recommendation-justification-grade","Internal"
http://fhir.awmf.org/awmf.ig/ValueSet/vs-rating-feasibility,0.2.0,draft,,RatingFeasibility,Rating Feasibility,"ValueSet listing values to reprensent how feasible will it be to implement the different alternatives and if there are any issues","StructureDefinition/recommendation-justification-grade","Internal"
http://fhir.awmf.org/awmf.ig/ValueSet/vs-rating-preference-and-values,0.2.0,draft,,RatingPreferenceAndValues,Rating Preference And Values,"ValueSet listing typical patient preferences and values as well as common issues or expected variability","StructureDefinition/recommendation-justification-grade","Internal"
http://fhir.awmf.org/awmf.ig/ValueSet/vs-rating-resources,0.2.0,draft,,RatingResources,Rating Resources,"ValueSet listing values to indicate if there are issues related to costs or resource use.","StructureDefinition/recommendation-justification-grade","Internal"
http://fhir.awmf.org/awmf.ig/ValueSet/vs-recommendation-direction,0.2.0,draft,,RecommendationDirectionVS,Recommendation Direction,"ValueSet defining the direction of a clinical recommendation.","StructureDefinition/recommendation-justification-grade,StructureDefinition/recommendation-justification-sign,StructureDefinition/recommendation-justification-expert-consensus,StructureDefinition/recommendation-justification-oxford-2011,StructureDefinition/recommendation-justification,StructureDefinition/recommendation-justification-oxford-2009,StructureDefinition/recommendation-justification-awmf","Internal"
http://fhir.awmf.org/awmf.ig/ValueSet/vs-recommendation-review-status,0.2.0,draft,,RecommendationReviewStatusVS,Recommendation Review Status Value Set,"ValueSet representing the review-related status of a recommendation in a new guideline version","StructureDefinition/ext-recommendation-review-status","Internal"
http://fhir.awmf.org/awmf.ig/ValueSet/vs-recommendation-strength-awmf,0.2.0,draft,,RecommendationStrengthAWMFVS,Recommendation Strength (AWMF) ValueSet,"ValueSet of strength of recommendations as defined in AWMF guideline methodology.","StructureDefinition/recommendation-justification-awmf","Internal"
http://fhir.awmf.org/awmf.ig/ValueSet/vs-recommendation-synthesis-type,0.2.0,draft,,RecommendationSynthesisTypeVS,Recommendation Synthesis Type,"ValueSet listing different synthesis Types of recommendations","StructureDefinition/recommendation","Internal"
http://fhir.awmf.org/awmf.ig/ValueSet/vs-recommendation-tags,0.2.0,draft,,RecommendationTagsVS,Recommendation Tags,"ValueSet listing different tags to use for recommendations","StructureDefinition/recommendation","Internal"
http://fhir.awmf.org/awmf.ig/ValueSet/vs-remark-type,0.2.0,draft,,RemarkTypeVS,Remark Type,"ValueSet listing types of remarks that can be associated with guidelines, including restrictions, warnings, and additional notes.","StructureDefinition/awmf-guideline-record-s2k,StructureDefinition/awmf-guideline-record-s3,StructureDefinition/guideline-registry-record,StructureDefinition/awmf-guideline-record-s2e,StructureDefinition/awmf-guideline-record-s1","Internal"
http://fhir.awmf.org/awmf.ig/ValueSet/vs-rob-2-overall-judgment,0.2.0,draft,,RoB2OverallJudmentVS,RoB2 Overall Judgment ValueSet,"ValueSet listing values to represent the overall judgment of risk of bias assessed by the RoB2 tool for evaluating risk of bias for randomized trials.",,"Internal"
http://fhir.awmf.org/awmf.ig/ValueSet/vs-robis-judgment-of-risk-of-bias,0.2.0,active,,ROBISJudgmentOfRiskOfBiasVS,ROBIS Judgment of Risk of Bias Value Set,"ValueSet encompassing all risk of bias judgment values from the ROBIS tool.",,"Internal"
http://fhir.awmf.org/awmf.ig/ValueSet/vs-robis-risk-of-bias-domains,0.2.0,active,,ROBISRiskOfBiasDomainsVS,ROBIS Risk of Bias Domains Value Set,"ValueSet encompassing all risk of bias domains from the ROBIS tool.",,"Internal"
http://fhir.awmf.org/awmf.ig/ValueSet/vs-sign-grade-of-recommendation,0.2.0,draft,,SIGNGradeOfRecommendationVS,SIGN Grade of Recommendation Value Set,"ValueSet encompassing all grades of recommendation from the SIGN (Scottish Intercollegiate Guidelines Network) Grades of Recommendation.",,"Internal"
http://fhir.awmf.org/awmf.ig/ValueSet/vs-sign-level-of-evidence,0.2.0,draft,,SIGNLevelOfEvidenceVS,SIGN Level of Evidence Value Set,"ValueSet encompassing all levels from the SIGN (Scottish Intercollegiate Guidelines Network) Levels of Evidence.","StructureDefinition/recommendation-justification-sign","Internal"
http://fhir.awmf.org/awmf.ig/ValueSet/vs-target-patient-group,0.2.0,draft,,TargetPatientGroupVS,Target Patient Group,"ValueSet listing patient population categories for guidelines, such as adults and children/adolescents.","StructureDefinition/awmf-guideline-record-s2k,StructureDefinition/awmf-guideline-record-s3,StructureDefinition/guideline-registry-record,StructureDefinition/awmf-guideline-record-s2e,StructureDefinition/awmf-guideline-record-s1","Internal"
http://hl7.org/fhir/ValueSet/administrative-gender,6.0.0-ballot3,active,"2.16.840.1.113883.4.642.3.1",AdministrativeGender,AdministrativeGender,"The gender of a person used for administrative purposes.","StructureDefinition/guideline-author","hl7.fhir.r6.core"
http://hl7.org/fhir/ValueSet/all-languages,6.0.0-ballot3,active,"2.16.840.1.113883.4.642.3.21",AllLanguages,All Languages,"This value set includes all possible codes from BCP-47 (see http://tools.ietf.org/html/bcp47)","StructureDefinition/guideline-author-role,StructureDefinition/conceptual-cohort-definition-outcome,StructureDefinition/guideline-attachment,StructureDefinition/conceptual-cohort-definition-intervention,StructureDefinition/evidence-internal-assessment-agreeii,StructureDefinition/pico-question,StructureDefinition/recommendation-justification-sign,StructureDefinition/evidence-internal-assessment-robis,StructureDefinition/recommendation-justification-oxford-2011,StructureDefinition/citation-list,StructureDefinition/awmf-member-organization,StructureDefinition/awmf-guideline-record-s3,StructureDefinition/guideline-registry-record,StructureDefinition/awmf-guideline-record-s2e,StructureDefinition/evidence-overall-assessment-grade,StructureDefinition/recommendation-justification-awmf,StructureDefinition/awmf-guideline-record-s1,StructureDefinition/medical-society,StructureDefinition/awmf-guideline,StructureDefinition/awmf-guideline-record-s2k,StructureDefinition/recommendation-justification-expert-consensus,StructureDefinition/conceptual-cohort-definition-comparator,StructureDefinition/evidence-internal-assessment-cochrane-rob,StructureDefinition/patient-organization,StructureDefinition/recommendation,StructureDefinition/outcome-evidence,StructureDefinition/conceptual-cohort-definition-population,StructureDefinition/recommendation-justification,StructureDefinition/evidence-overall-assessment-oxford2011,StructureDefinition/recommendation-justification-grade,StructureDefinition/evidence-internal-assessment-amstar2,StructureDefinition/guideline-author,StructureDefinition/evidence-assessment,StructureDefinition/evidence-internal-validity-assessment,StructureDefinition/evidence-overall-quality-assessment,StructureDefinition/recommendation-justification-oxford-2009,StructureDefinition/evidence-report-with-contact-slices","hl7.terminology.r5"
http://hl7.org/fhir/ValueSet/artifact-relationship-type,6.0.0-ballot3,active,"2.16.840.1.113883.4.642.3.2957",ArtifactRelationshipType,Artifact Relationship Type,"Type of relationship to the related artifact.","StructureDefinition/evidence-internal-assessment-agreeii,StructureDefinition/recommendation-justification-sign,StructureDefinition/evidence-internal-assessment-robis,StructureDefinition/recommendation-justification-oxford-2011,StructureDefinition/awmf-guideline-record-s3,StructureDefinition/guideline-registry-record,StructureDefinition/awmf-guideline-record-s2e,StructureDefinition/evidence-overall-assessment-grade,StructureDefinition/recommendation-justification-awmf,StructureDefinition/awmf-guideline-record-s1,StructureDefinition/awmf-guideline,StructureDefinition/awmf-guideline-record-s2k,StructureDefinition/recommendation-justification-expert-consensus,StructureDefinition/evidence-internal-assessment-cochrane-rob,StructureDefinition/recommendation,StructureDefinition/outcome-evidence,StructureDefinition/recommendation-justification,StructureDefinition/evidence-overall-assessment-oxford2011,StructureDefinition/recommendation-justification-grade,StructureDefinition/evidence-internal-assessment-amstar2,StructureDefinition/evidence-assessment,StructureDefinition/evidence-internal-validity-assessment,StructureDefinition/evidence-overall-quality-assessment,StructureDefinition/recommendation-justification-oxford-2009,StructureDefinition/evidence-report-with-contact-slices","hl7.fhir.r6.core"
http://hl7.org/fhir/ValueSet/artifactassessment-disposition,6.0.0-ballot3,draft,"2.16.840.1.113883.4.642.3.3155",ArtifactAssessmentDisposition,Artifact Assessment Disposition,"Possible values for the disposition of a comment or change request, typically used for comments and change requests, to indicate the disposition of the responsible party towards the changes suggested by the comment or change request.","StructureDefinition/recommendation-justification-expert-consensus,StructureDefinition/evidence-internal-assessment-cochrane-rob,StructureDefinition/recommendation-justification,StructureDefinition/evidence-overall-assessment-oxford2011,StructureDefinition/evidence-internal-assessment-agreeii,StructureDefinition/recommendation-justification-grade,StructureDefinition/recommendation-justification-sign,StructureDefinition/evidence-internal-assessment-amstar2,StructureDefinition/evidence-assessment,StructureDefinition/evidence-internal-validity-assessment,StructureDefinition/evidence-internal-assessment-robis,StructureDefinition/recommendation-justification-oxford-2011,StructureDefinition/evidence-overall-quality-assessment,StructureDefinition/recommendation-justification-oxford-2009,StructureDefinition/recommendation-justification-awmf,StructureDefinition/evidence-overall-assessment-grade","hl7.fhir.r6.core"
http://hl7.org/fhir/ValueSet/artifactassessment-workflow-status,6.0.0-ballot3,draft,"2.16.840.1.113883.4.642.3.3157",ArtifactAssessmentWorkflowStatus,Artifact Assessment Workflow Status,"Possible values for the workflow status of the comment or assessment, typically used to coordinate workflow around the process of accepting and rejecting changes and comments on the artifact.","StructureDefinition/recommendation-justification-expert-consensus,StructureDefinition/evidence-internal-assessment-cochrane-rob,StructureDefinition/recommendation-justification,StructureDefinition/evidence-overall-assessment-oxford2011,StructureDefinition/evidence-internal-assessment-agreeii,StructureDefinition/recommendation-justification-grade,StructureDefinition/recommendation-justification-sign,StructureDefinition/evidence-internal-assessment-amstar2,StructureDefinition/evidence-assessment,StructureDefinition/evidence-internal-validity-assessment,StructureDefinition/evidence-internal-assessment-robis,StructureDefinition/recommendation-justification-oxford-2011,StructureDefinition/evidence-overall-quality-assessment,StructureDefinition/recommendation-justification-oxford-2009,StructureDefinition/recommendation-justification-awmf,StructureDefinition/evidence-overall-assessment-grade","hl7.fhir.r6.core"
http://hl7.org/fhir/ValueSet/attribute-estimate-type,6.0.0-ballot3,draft,"2.16.840.1.113883.4.642.3.3050",AttributeEstimateType,Attribute Estimate Type,"A statistic about a statistic, e.g.  Confidence interval or p-value","StructureDefinition/outcome-evidence","THO"
http://hl7.org/fhir/ValueSet/body-site,6.0.0-ballot3,draft,"2.16.840.1.113883.4.642.3.653,2.16.840.1.113883.4.642.2.78,2.16.840.1.113883.4.642.3.141",SNOMEDCTBodyStructures,SNOMED CT Body Structures,"This value set includes all codes from [SNOMED CT](http://snomed.info/sct) where concept is-a 442083009 (Anatomical or acquired body site (body structure)).","StructureDefinition/guideline-attachment","SCT"
http://hl7.org/fhir/ValueSet/c80-facilitycodes,6.0.0-ballot3,active,"2.16.840.1.113883.3.88.12.80.67,2.16.840.1.113883.4.642.2.131",FacilityTypeCodeValueSet,Facility Type Code Value Set,"This is the code representing the type of organizational setting where the clinical encounter,    service, interaction, or treatment occurred. The value set used for Healthcare Facility    Type has been defined by HITSP to be the value set reproduced from HITSP C80 Table 2-147.","StructureDefinition/guideline-attachment","SCT"
http://hl7.org/fhir/ValueSet/c80-practice-codes,6.0.0-ballot3,active,"2.16.840.1.113883.4.642.2.134,2.16.840.1.113883.3.88.12.80.72",PracticeSettingCodeValueSet,Practice Setting Code Value Set,"This is the code representing the clinical specialty of the clinician or provider who    interacted with, treated, or provided a service to/for the patient. The value set used    for clinical specialty has been limited by HITSP to the value set reproduced from HITSP    C80 Table 2-149 Clinical Specialty Value Set Definition.","StructureDefinition/guideline-author-role,StructureDefinition/guideline-attachment","SCT"
http://hl7.org/fhir/ValueSet/certainty-rating,6.0.0-ballot3,draft,"2.16.840.1.113883.4.642.3.3049",EvidenceCertaintyRating,Evidence Certainty Rating,"The assessment of quality, confidence, or certainty.","StructureDefinition/recommendation-justification-expert-consensus,StructureDefinition/evidence-internal-assessment-cochrane-rob,StructureDefinition/outcome-evidence,StructureDefinition/recommendation-justification,StructureDefinition/evidence-overall-assessment-oxford2011,StructureDefinition/evidence-internal-assessment-agreeii,StructureDefinition/recommendation-justification-grade,StructureDefinition/recommendation-justification-sign,StructureDefinition/evidence-internal-assessment-amstar2,StructureDefinition/evidence-assessment,StructureDefinition/evidence-internal-validity-assessment,StructureDefinition/evidence-internal-assessment-robis,StructureDefinition/recommendation-justification-oxford-2011,StructureDefinition/evidence-overall-quality-assessment,StructureDefinition/recommendation-justification-oxford-2009,StructureDefinition/recommendation-justification-awmf,StructureDefinition/evidence-overall-assessment-grade","hl7.fhir.r6.core"
http://hl7.org/fhir/ValueSet/certainty-type,6.0.0-ballot3,draft,"2.16.840.1.113883.4.642.3.3043",EvidenceCertaintyType,Evidence Certainty Type,"The aspect of quality, confidence, or certainty.","StructureDefinition/recommendation-justification-expert-consensus,StructureDefinition/evidence-internal-assessment-cochrane-rob,StructureDefinition/outcome-evidence,StructureDefinition/recommendation-justification,StructureDefinition/evidence-overall-assessment-oxford2011,StructureDefinition/evidence-internal-assessment-agreeii,StructureDefinition/recommendation-justification-grade,StructureDefinition/recommendation-justification-sign,StructureDefinition/evidence-internal-assessment-amstar2,StructureDefinition/evidence-assessment,StructureDefinition/evidence-internal-validity-assessment,StructureDefinition/evidence-internal-assessment-robis,StructureDefinition/recommendation-justification-oxford-2011,StructureDefinition/evidence-overall-quality-assessment,StructureDefinition/recommendation-justification-oxford-2009,StructureDefinition/recommendation-justification-awmf,StructureDefinition/evidence-overall-assessment-grade","hl7.fhir.r6.core"
http://hl7.org/fhir/ValueSet/characteristic-offset,6.0.0-ballot3,draft,"2.16.840.1.113883.4.642.3.3061",CharacteristicOffset,Characteristic Offset,"Reference point for characteristic.valueQuantity.","StructureDefinition/pico-question,StructureDefinition/conceptual-cohort-definition-comparator,StructureDefinition/conceptual-cohort-definition-outcome,StructureDefinition/conceptual-cohort-definition-population,StructureDefinition/conceptual-cohort-definition-intervention","hl7.fhir.r6.core"
http://hl7.org/fhir/ValueSet/citation-artifact-classifier,6.0.0-ballot3,draft,"2.16.840.1.113883.4.642.3.3092",CitationArtifactClassifier,Citation Artifact Classifier,"Citation artifact classifier","StructureDefinition/awmf-guideline-record-s2k,StructureDefinition/recommendation,StructureDefinition/awmf-guideline-record-s3,StructureDefinition/guideline-registry-record,StructureDefinition/awmf-guideline-record-s2e,StructureDefinition/awmf-guideline-record-s1","hl7.fhir.r6.core"
http://hl7.org/fhir/ValueSet/common-tags,6.0.0-ballot3,draft,"2.16.840.1.113883.4.642.3.79",CommonTags,Common Tags,"Common Tag Codes defined by FHIR project","StructureDefinition/awmf-guideline-record-s2k,StructureDefinition/awmf-guideline-record-s3,StructureDefinition/guideline-registry-record,StructureDefinition/awmf-guideline-record-s2e,StructureDefinition/awmf-guideline-record-s1","THO (V3),THO"
http://hl7.org/fhir/ValueSet/composition-attestation-mode,6.0.0-ballot3,draft,"2.16.840.1.113883.4.642.3.233,2.16.840.1.113883.4.642.3.238,2.16.840.1.113883.4.642.2.120",CompositionAttestationMode,Composition Attestation Mode,"The way in which a person authenticated a composition.","StructureDefinition/guideline-attachment","hl7.fhir.r6.core"
